text,fiscal_period_ref,speaker,role,page,section,reporting_period,date_of_call
"We have approximately $561 billion of HQLA and approximately $690 billion of loans and we maintain total liquidity resources of $965 billion. Our LCR decreased modestly to 116%. And our tangible book value per share was $86.19, up 6%.",quarter,Mark Mason,CFO,6,Prepared remarks,Q4_2023,2024-01-12
"On the bottom left corner of the slide, we show a full year CET1 walk to provide more detail on the drivers in 2023.",year,Mark Mason,CFO,6,Prepared remarks,Q4_2023,2024-01-12
"First, we generated $8.0 billion of net income to common, which added 70 basis points.",year,Mark Mason,CFO,6,Prepared remarks,Q4_2023,2024-01-12
"Second, we returned $6.1 billion in the form of common dividends and share repurchases, which drove a reduction of about 53 basis points.",year,Mark Mason,CFO,6,Prepared remarks,Q4_2023,2024-01-12
"Third, we benefitted from the impact of lower rates on our AFS investment portfolio, which drove an increase of 20 basis points.",year,Mark Mason,CFO,6,Prepared remarks,Q4_2023,2024-01-12
"And finally, the remaining 3 basis points was largely driven by higher RWA, partially offset by capital releases from the exit markets.",year,Mark Mason,CFO,6,Prepared remarks,Q4_2023,2024-01-12
"We ended the quarter with a 13.3% CET1 capital ratio, approximately 100 basis points above our regulatory capital requirement of 12.3%.   As you can see, we have grown our CET1 ratio by approximately 30 basis points over the course of the year while returning over $6 billion to shareholders in common dividends and repurchases.",both,Mark Mason,CFO,6,Prepared remarks,Q4_2023,2024-01-12
"Before I take you through each business, as Jane mentioned, we are not satisfied with the performance and returns of our businesses and therefore we are laser focused on executing against our strategy, simplifying the organization and right sizing the expense base. As a reminder the investments that we have been making have impacted each of the businesses as you will see in the next few slides.",both,Mark Mason,CFO,6,Prepared remarks,Q4_2023,2024-01-12
"So now turning to slide 13, where we show the results for Services for the fourth quarter and the full year.  Revenues were up 6% this quarter, largely driven by NII across TTS and Securities Services, partially offset by NIR driven by the Argentina devaluation.",quarter,Mark Mason,CFO,6,Prepared remarks,Q4_2023,2024-01-12
Services non-interest revenues were up 20% excluding the impact of the Argentina devaluation.,quarter,Mark Mason,CFO,6,Prepared remarks,Q4_2023,2024-01-12
"Expenses increased 9%, primarily driven by continued investments in technology, product innovation and client experience.",quarter,Mark Mason,CFO,6,Prepared remarks,Q4_2023,2024-01-12
"Cost of credit was $646 million, driven by a reserve build of approximately $652 million, primarily associated with transfer risk in Russia and Argentina.",quarter,Mark Mason,CFO,6,Prepared remarks,Q4_2023,2024-01-12
"Net income decreased to $776 million, as higher revenues were more than offset by higher cost of credit and higher expenses.",quarter,Mark Mason,CFO,6,Prepared remarks,Q4_2023,2024-01-12
"Average loans were up 6%, primarily driven by strong demand for working capital loans in TTS, both in North America and internationally. Average deposits were down 3% as the impact of quantitative tightening more than offset new client acquisitions and deepening with existing clients, however sequentially, deposits were up 1%.",quarter,Mark Mason,CFO,6,Prepared remarks,Q4_2023,2024-01-12
"Services delivered an RoTCE of 13.4% for the quarter.  And for the full year, Services delivered an RoTCE of 20% on $18.1 billion of revenues.",both,Mark Mason,CFO,6,Prepared remarks,Q4_2023,2024-01-12
"On slide 14, we show the results for Markets for the fourth quarter and the full year. Markets revenues were down 19%, versus a strong quarter last year, driven by a decline in fixed income and the impact of the devaluation, partially offset by an increase in equities.",quarter,Mark Mason,CFO,6,Prepared remarks,Q4_2023,2024-01-12
"Fixed Income revenues decreased by 25%, largely driven by rates and currencies on lower volatility and a significant slowdown in December as well as the impact of devaluation.",quarter,Mark Mason,CFO,6,Prepared remarks,Q4_2023,2024-01-12
"However, we saw good underlying momentum in equities, with revenues up 9%, driven by gains across all products. And we continued to grow prime balances while making solid progress on our revenue-to-RWA target.",quarter,Mark Mason,CFO,6,Prepared remarks,Q4_2023,2024-01-12
"Expenses increased 8%, driven by investments in transformation and risk and controls and volume related costs, partially offset by productivity savings.",quarter,Mark Mason,CFO,6,Prepared remarks,Q4_2023,2024-01-12
"Cost of credit was $209 million, driven by a reserve build of approximately $179 million, primarily associated with the transfer risk in Russia and Argentina.",quarter,Mark Mason,CFO,6,Prepared remarks,Q4_2023,2024-01-12
"Markets reported a net loss of $134 million, as revenues were more than offset by higher expenses and higher cost of credit.",quarter,Mark Mason,CFO,6,Prepared remarks,Q4_2023,2024-01-12
"Average loans increased 4% to $115 billion, as we saw increased client demand for credit driving growth in warehouse lending.  Average trading assets increased 18% to $391 billion, largely driven by treasuries and mortgage-backed securities, given the strong client activity in fixed income for much of the year.",quarter,Mark Mason,CFO,6,Prepared remarks,Q4_2023,2024-01-12
"While it was a challenging quarter, Markets performed relatively well for the full year with revenue of $18.9 billion and an RoTCE of 7.4%, compared with very strong performance in the prior year. And we are focused on improving returns over time through a combination of revenue growth, expense discipline, and capital optimization.",both,Mark Mason,CFO,6,Prepared remarks,Q4_2023,2024-01-12
"On slide 15, we show the results for Banking for the fourth quarter and the full year.  Banking revenues increased 22%, driven by growth in investment banking fees and lower losses on loan hedges, partially offset by lower Corporate Lending revenue.",quarter,Mark Mason,CFO,6,Prepared remarks,Q4_2023,2024-01-12
"Investment banking revenues increased 27% YoY, driven by DCM and Advisory due to improvements in market sentiment.",quarter,Mark Mason,CFO,7,Prepared remarks,Q4_2023,2024-01-12
"In Advisory, we saw signs of strength across Technology, Healthcare and Energy, and we feel good about the strength of our pipeline.",quarter,Mark Mason,CFO,7,Prepared remarks,Q4_2023,2024-01-12
"Corporate Lending revenues excluding mark-to-market on loan hedges decreased 26%, largely driven by lower revenue share from Investment Banking, Services and Markets.",quarter,Mark Mason,CFO,7,Prepared remarks,Q4_2023,2024-01-12
"Expenses increased 37%, primarily driven by the absence of an operational loss reserve release in the prior year. Excluding the reserve release, expenses were roughly flat.",quarter,Mark Mason,CFO,7,Prepared remarks,Q4_2023,2024-01-12
"Cost of credit was $185 million, driven by a reserve build associated with the transfer risk in Russia and Argentina. The NCL rate was 32 basis points of average loans and we ended the quarter with a reserve to funded loan ratio of 1.6%.",quarter,Mark Mason,CFO,7,Prepared remarks,Q4_2023,2024-01-12
Banking reported a net loss of $322 million as higher expenses and cost of credit more than offset higher revenues. RoTCE was negative 6.0% for the quarter.,quarter,Mark Mason,CFO,7,Prepared remarks,Q4_2023,2024-01-12
"And for the full year, Banking reported an RoTCE of negative 0.2% on $4.6 billion of revenues.",year,Mark Mason,CFO,7,Prepared remarks,Q4_2023,2024-01-12
"So clearly, we have more work to do on returns. And while it’s difficult to predict when activity will normalize, we’re positioning the business to capitalize on the rebound in the market wallet. And that includes continuing to invest in key growth areas, upgrading talent in traditional sectors, and continuing to right size the business.",both,Mark Mason,CFO,7,Prepared remarks,Q4_2023,2024-01-12
"On slide 16, we show the results for Wealth for the fourth quarter and the full year.  Wealth revenues decreased 3%, driven by lower deposit spreads, partially offset by lower mortgage funding cost and higher investment fee revenues.",quarter,Mark Mason,CFO,7,Prepared remarks,Q4_2023,2024-01-12
"We’re seeing good momentum in non-interest revenue, which was up 13% in the fourth quarter, driven by higher investment assets, increased client activity and market performance.",quarter,Mark Mason,CFO,7,Prepared remarks,Q4_2023,2024-01-12
"Expenses were up 4%, primarily driven by investments in risk and controls and technology, partially offset by re-pacing strategic investments and tighter expense control as we begin to right size the expense base in the business.",quarter,Mark Mason,CFO,7,Prepared remarks,Q4_2023,2024-01-12
"Wealth reported net income of $5 million, as revenues were mostly offset by higher expenses. Client balances increased 6%, primarily driven by higher client investment assets, partially offset by lower deposit balances.",quarter,Mark Mason,CFO,7,Prepared remarks,Q4_2023,2024-01-12
"Average loans were flat, as we continued to optimize capital usage. Average deposits decreased 2%, reflecting the continued mix shift of deposits to higher-yielding investments on Citi’s platform.",quarter,Mark Mason,CFO,7,Prepared remarks,Q4_2023,2024-01-12
"Client investment assets were up 12%, driven by new acquisitions and the benefit from higher market valuations.",quarter,Mark Mason,CFO,7,Prepared remarks,Q4_2023,2024-01-12
"And we’re seeing good momentum in net new assets, which more than doubled to $16 billion for the quarter.",quarter,Mark Mason,CFO,7,Prepared remarks,Q4_2023,2024-01-12
"For the full year, we added an estimated $21 billion in net new assets.",year,Mark Mason,CFO,7,Prepared remarks,Q4_2023,2024-01-12
"RoTCE was 0.1% for the quarter. And for the full year, RoTCE was 2.6% on $7.1 billion of revenues.",both,Mark Mason,CFO,7,Prepared remarks,Q4_2023,2024-01-12
"Looking ahead, we’re going to improve the returns in the business as we invest in talent to execute on our refocused strategy to drive investment revenue with an eye toward right sizing the expense base. We will wind down non-core initiatives, exit less productive performers and enhance discipline across every expense line.",both,Mark Mason,CFO,7,Prepared remarks,Q4_2023,2024-01-12
"On slide 17, we show the results for US Personal Banking for the fourth quarter and the full year. US Personal Banking revenues increased 12%.",quarter,Mark Mason,CFO,7,Prepared remarks,Q4_2023,2024-01-12
"Branded Cards revenues increased 10%, driven by higher net interest margin and interest-earning balance growth of 13%.",quarter,Mark Mason,CFO,7,Prepared remarks,Q4_2023,2024-01-12
"And we continue to see healthy growth in new account acquisitions, up 8% and spend volumes up 3%.",quarter,Mark Mason,CFO,7,Prepared remarks,Q4_2023,2024-01-12
"Retail Services revenues increased 15%, also driven by higher net interest margin and interest-earning balance growth of 11%, as well as lower partner payments due to higher net credit losses.",quarter,Mark Mason,CFO,7,Prepared remarks,Q4_2023,2024-01-12
"Retail Banking revenues increased 15%, driven by higher deposit spreads, loan growth and improved mortgage margins.",quarter,Mark Mason,CFO,7,Prepared remarks,Q4_2023,2024-01-12
"Expenses decreased 1%, as higher expenses to support lending programs and client engagement, as well as the rollout of Simplified Banking were offset by lower non-volume related expenses.",quarter,Mark Mason,CFO,7,Prepared remarks,Q4_2023,2024-01-12
"Cost of credit of $2.1 billion increased 20%, driven by higher NCLs, partially offset by a lower ACL build.",quarter,Mark Mason,CFO,7,Prepared remarks,Q4_2023,2024-01-12
"Net income increased to $201 million, driven by higher revenues, partially offset by higher cost of credit. Average deposits decreased 5%, driven by the transfer of relationships and the associated deposits to our Wealth business.",quarter,Mark Mason,CFO,7,Prepared remarks,Q4_2023,2024-01-12
"We continued to make progress against our digital strategy, with digital deposits up 14% and active digital users increasing 6%.",quarter,Mark Mason,CFO,7,Prepared remarks,Q4_2023,2024-01-12
"RoTCE for the quarter was 3.6%.  And for the full year, US Personal Banking delivered an ROTCE of 8.3% on $19.2 billion of revenue.",both,Mark Mason,CFO,7,Prepared remarks,Q4_2023,2024-01-12
"Here again, we are focused on improving the return profile of the business, managing through this part of the credit cycle and continuing to make progress in Retail Banking will be key.",both,Mark Mason,CFO,7,Prepared remarks,Q4_2023,2024-01-12
"On slide 18, we show results for All Other on a managed basis, which includes Corporate Other and Legacy Franchises and excludes divestiture-related items. Revenues decreased 17%, driven by a decrease in NII of 29%, largely driven by the closed exits and wind-downs, partially offset by higher non-interest revenue.",quarter,Mark Mason,CFO,7,Prepared remarks,Q4_2023,2024-01-12
"And expenses increased to $4.5 billion, driven by the FDIC special assessment and restructuring costs, partially offset by lower expenses in both wind-down and exit markets.",quarter,Mark Mason,CFO,8,Prepared remarks,Q4_2023,2024-01-12
"Turning to slide 20, as we kick off 2024, the environment remains somewhat uncertain and Markets remains difficult to predict, but based on what we see today we expect revenues to be approximately $80 to $81 billion as shown on the left side of the slide.",both,Mark Mason,CFO,8,Prepared remarks,Q4_2023,2024-01-12
"And on the right side of the slide, we list the key drivers.",both,Mark Mason,CFO,8,Prepared remarks,Q4_2023,2024-01-12
"In TTS, we expect revenue growth to be driven by new client wins, deepening with our existing clients and continued momentum with Commercial Clients as we continue to leverage our global footprint and product innovations.",both,Mark Mason,CFO,8,Prepared remarks,Q4_2023,2024-01-12
"In Securities Services, we have a very healthy pipeline and will continue to onboard assets under custody from new mandates, win new clients and deepen relationships with existing clients.",both,Mark Mason,CFO,8,Prepared remarks,Q4_2023,2024-01-12
"In Investment Banking we anticipate a rebound in activity and to maintain our position as the wallet recovers. Over time, we do expect the investments that we’ve made in key growth areas, such as healthcare and technology, to allow us to gain share.",both,Mark Mason,CFO,8,Prepared remarks,Q4_2023,2024-01-12
"And we also expect a modest rebound in Wealth, as we execute on our refocused strategy with an eye towards growing investment fees, particularly with our existing clients.",both,Mark Mason,CFO,8,Prepared remarks,Q4_2023,2024-01-12
"In USPB, we expect continued growth in cards balances driven by the investments we have been making as well as lower partner payments in retail services to continue to drive revenue growth. We also expect to continue to improve our retail branch performance.",both,Mark Mason,CFO,8,Prepared remarks,Q4_2023,2024-01-12
"And as it relates to NII, excluding Markets, we expect net interest income to be down modestly as the volume growth we expect from loans and deposits is more than offset by lower US rates and the reduction from the closed exits and wind-downs.",both,Mark Mason,CFO,8,Prepared remarks,Q4_2023,2024-01-12
"Turning to slide 21, we expect expenses to be approximately $53.5 to $53.8 billion, down from $54.3 billion, subject to volume-related expenses.",both,Mark Mason,CFO,8,Prepared remarks,Q4_2023,2024-01-12
"The decrease in expenses will be driven by the benefits of our organizational simplification, a continued reduction from exit markets and wind-downs, and productivity savings, partially offset by investments in risk and controls and volume-related expenses.",both,Mark Mason,CFO,8,Prepared remarks,Q4_2023,2024-01-12
"Embedded in this guidance includes an elevated level of severance, as well as additional potential costs related to the organizational simplification totaling approximately $700 million to $1 billion.  This will contribute to reducing headcount over 2024 and the medium term, which we will discuss on the next slide.",both,Mark Mason,CFO,8,Prepared remarks,Q4_2023,2024-01-12
"On slide 22, we show the drivers of headcount and expense reduction over the medium-term. As we’ve discussed in the past, there are three drivers that will reduce our expenses.",both,Mark Mason,CFO,8,Prepared remarks,Q4_2023,2024-01-12
Organizational simplification including the reduction of management layers. Eliminating stranded costs as we take additional actions to reduce excess overhead in light of the exit markets. And realizing productivity savings from our investments in the transformation and technology.,both,Mark Mason,CFO,8,Prepared remarks,Q4_2023,2024-01-12
"We expect the combination of these three drivers to reduce our headcount by a net 20 thousand, excluding Mexico, and generate a net run rate save of $2 to $2.5 billion over the medium term.",both,Mark Mason,CFO,8,Prepared remarks,Q4_2023,2024-01-12
"This will underpin our path to $51 to $53 billion of expenses, subject to volume-related expenses.  Both the headcount and expense reduction will allow us to right size the firm and businesses to improve performance and returns.",both,Mark Mason,CFO,8,Prepared remarks,Q4_2023,2024-01-12
"On slide 23, we show our outlook for U.S. Cards in 2024. In terms of credit performance, based on the trends that we’re seeing, we expect NCL rates both in Branded Cards and Retail Services portfolios to rise above pre-COVID levels and peak in 2024.",both,Mark Mason,CFO,8,Prepared remarks,Q4_2023,2024-01-12
"On a full-year basis for 2024, we expect the Branded Cards NCL rate to be in the range of 3.5% to 4.0% and the Retail Services NCL rate to be in the range of 5.75% to 6.25%.",both,Mark Mason,CFO,8,Prepared remarks,Q4_2023,2024-01-12
"From an allowance perspective, we are reserved for a weighted 8-quarter average unemployment rate of almost 5.0%, which imbeds a downside scenario of approximately 6.8%.",both,Mark Mason,CFO,8,Prepared remarks,Q4_2023,2024-01-12
ACL builds in 2024 will primarily be a function of the volume growth that we see as well as changes in the macro scenarios and the probabilities associated with them. And we expect continued momentum in cards albeit more in line with mid-single digit loan growth.,both,Mark Mason,CFO,8,Prepared remarks,Q4_2023,2024-01-12
"On slide 24, we summarize our medium-term targets.  While a lot has changed in the macro environment since Investor Day, our strategy has not, and we are on a path to the 11-12% RoTCE in the medium term, driven by top line revenue growth and expense reductions.",both,Mark Mason,CFO,8,Prepared remarks,Q4_2023,2024-01-12
"From a revenue perspective, we continue to expect a 4-5% revenue CAGR in the medium-term, including the ongoing reduction of revenue from the closing of the exits and the wind-downs.",both,Mark Mason,CFO,9,Prepared remarks,Q4_2023,2024-01-12
"From an expense perspective, we are now on the path to lowering our expenses, beginning in 2024.",both,Mark Mason,CFO,9,Prepared remarks,Q4_2023,2024-01-12
"From a credit perspective, we expect credit costs to be a function of portfolio mix, volumes and macro assumptions.",both,Mark Mason,CFO,9,Prepared remarks,Q4_2023,2024-01-12
And we are committed to returning capital to our shareholders and in fact expect to do modest buybacks in 1Q 2024.,both,Mark Mason,CFO,9,Prepared remarks,Q4_2023,2024-01-12
"So, to wrap it up, while the world has changed significantly and the components have shifted since Investor Day, our strategy has not. And we are confident we are on the right path to deliver our 11-12% RoTCE in the medium term.",both,Mark Mason,CFO,9,Prepared remarks,Q4_2023,2024-01-12
"With that, Jane and I will be happy to take your questions.",both,Mark Mason,CFO,9,Prepared remarks,Q4_2023,2024-01-12
Our first question will come from Mike Mayo with Wells Fargo. Your line is now open. Please go ahead.,both,Operator,Host,9,Q and A,Q4_2023,2024-01-12
"Hi. I looked in detail at the earnings presentation, especially slide 4, and I think the question is, on many people's minds, I count 12 restructurings at Citigroup. And I count 12 restructurings that have failed at Citigroup. You might disagree with the number 12, It could be 5, it could be 8, it could be 12, it could be more, but I've not spoken to one person of any investor who would say that Citi has succeeded on its prior restructuring. So, the question is, why is this time different? Number one, who is this new and improved Citigroup. Number two, why aren't expenses down even move, especially when few people that I talk to think you'll hit your revenue target? And three, Jane, what is your conviction level of getting to that 11% to 12% RoTCE in 2025 or 2026? Thank you.",both,Mike Mayo,Analyst,9,Q and A,Q4_2023,2024-01-12
"Well, thank you very much indeed, Mike. I'll start with, who is Citi? Citi is, I'm delighted to say, finally simple. At Investor Day, I set out a vision to be the preeminent banking partner for clients with cross border needs. That vision was based on five core interconnected businesses. We set off on a deliberate path to get there, and over the last three years we've done so.",both,Jane Fraser,CEO,9,Q and A,Q4_2023,2024-01-12
"Page 4 is who we are today. We are five interconnected businesses; no more, no less. We have our organization that now aligns with those five businesses, and this enables us to focus on two priorities. The first is improving the performance and the returns of those five core businesses, so that we can meet the medium-term RoTCE target we laid out. And the second is on addressing our regulatory issues through the transformation. And I would also be, I need to note that I fully recognize that 2024 is an inflection year, Mike. And I and the management team are accountable to deliver. And that you and our investors have the transparency you need to hold us accountable.",both,Jane Fraser,CEO,9,Q and A,Q4_2023,2024-01-12
"So, why is this time different? Look, it's not lost on me that there's been many attempts in the past to change this firm. I and the management are fully committed to transforming this company for the long term and we are addressing the issues that have held us back in the past. And you've got proof points of the last three years where we've made a lot of tough decisions and we have put through a tremendous amount of change to get to the simple Citi that we are today. We completely reset our strategy. So, we now have a significantly more focused business and operating model.",both,Jane Fraser,CEO,9,Q and A,Q4_2023,2024-01-12
"We've announced the most consequential set of changes to our organizational model, and frankly, from my perspective, more importantly, how we run the bank, since the financial crisis, aimed at simplifying the bank and increasing accountability. You've seen we’ve moved quickly. We're on track with our execution of this effort. And it will generate over $1 billion of run rate saves the end of the first quarter, purely from the organization efforts that we've put in that we announced in September.",both,Jane Fraser,CEO,9,Q and A,Q4_2023,2024-01-12
"We've done this while investing and I think this is another difference. We've invested heavily in our transformation. And while that was catalyzed by our consent orders, these investments will ultimately deliver benefits from automation, from well-governed data, from consolidated platforms. We also have made significant investments in our business to support the 4% to 5% revenue growth and to ensure client momentum. And those investments have helped us expand our product suite, invest in digital capabilities, automate our processes, capture synergies through the client organization.",both,Jane Fraser,CEO,9,Q and A,Q4_2023,2024-01-12
"We've also brought in some incredible external talent in key strategic areas, including Andy, to lead Wealth. And we now have a good balance between experienced Citi people and external talent with fresh perspectives through multiple layers of the organization.",both,Jane Fraser,CEO,10,Q and A,Q4_2023,2024-01-12
"So, we are doing things the right way, we're doing it for the long term and we're moving with urgency. We will need and are spending the money that we need to, to address our regulatory requirements, but that's already embedded in our path to the 11% to 12% RoTCE in the medium term. And this already feels like a different bank. We have more work to do. I recognize 2024 is a critical year, and as I said, the decks are much clearer now, so that we can focus on two imperatives: improving our business performance and executing the transformation. Neither is an entirely linear path as we've seen over the last three years. We all know that. We get we have to build our credibility. We're committed to doing so. And we are providing far more transparency around the business performance, so investors have a better sense of how we're doing. And I and my management team, to your final question, are fully accountable for getting this all done. We will.",both,Jane Fraser,CEO,10,Q and A,Q4_2023,2024-01-12
"Mark, expenses?",both,Jane Fraser,CEO,10,Q and A,Q4_2023,2024-01-12
