text,fiscal_period_ref,speaker,role,page,section,reporting_period,date_of_call
"Yeah, thanks, Jane. And why aren't expenses down more? I think to your point, Jane, we've been investing in the franchise both on the front-end, and importantly, on the transformation and the risk and controls. What I would point out is that, in 2023, we delivered expenses of $54.3 billion ex the FDIC charge. That is the guidance that we gave. But I also highlight that we also included $780 million associated with the restructuring charge. That is more than I had articulated in the way of guidance. So, the capacity that we created through our efforts through the year, we use that in a smart way. We use that to fund the org simplification cost, so that we can realize the savings down the line. And we're going to continue to manage our expenses in a disciplined and smart fashion. That means spending what we need to spend on the transformation and risk and controls, but driving greater efficiencies and productivities along the way to ensure we get to that 11% to 12%. And to your point, if revenues are to come down or come in lower than expected, we'll adjust the expenses accordingly.",both,Mark Mason,CFO,10,Q and A,Q4_2023,2024-01-12
Thank you. Our next question comes from Glenn Schorr with Evercore. Your line is now open.,both,Operator,Host,10,Q and A,Q4_2023,2024-01-12
"Hi. Thanks very much. So, you're clearly making a lot of progress and I hate to like, ask this question too early, but I think it is important. Your expense guidance is good, your revenue guide is good, and you have your arms around the expenses. The question I have is, how do you think about balancing that near-term profitability improvement that we all want desperately with making sure you do make the right investments? Because if you look around the world there's a lot of places to grow, whether it be a branch network, or the wealth management aspirations that you have, or the digital investments. So, how do we know that all the right future investments are being made while you extract costs in all the good ways that you've been doing?",both,Glenn Schorr,Analyst,10,Q and A,Q4_2023,2024-01-12
"Yeah, thanks, Glenn. I guess, I'll start, and Jane, feel free to add in on it. Look, it is a balancing act, right, and we do look at each of our five core businesses. We obviously are clear on the strategy, but where's the growth? Where are the return opportunities associated with them? And how do we ensure we're deploying resources after them in order to deliver for the client and deliver on those returns over time? We have to juxtapose that against the required investment to modernize our operations and we're making those trade-offs on a regular basis. But importantly, when we do invest to capture those growth opportunities, we're trying to be agile about it, which means if those opportunities don't play out in the way we're expecting because the cycle just doesn't mature or materialize in that fashion, we've got to be disciplined enough to dial them back, and that's what you've seen over the past year plus, is that we've been investing in the business.",both,Mark Mason,CFO,10,Q and A,Q4_2023,2024-01-12
"Where we didn't see the upside that we anticipated, we dialed back that spend, right, and that's the type of iterative process, if you will, Glenn, that we're putting in place to ensure that on the other side of this, we're still positioned to capture growth. Investment Banking, for example, we have invested in healthcare, in technology, building out to prepare ourselves for when that market rebounds. We feel good about that. We've done similar things in the way of our Wealth business. We're investing heavily in our TTS franchise to ensure we can remain competitive there, so it's that type of discipline that's required. It is sometimes a trade-off, but it's one that we've been very focused on being smart about.",both,Mark Mason,CFO,11,Q and A,Q4_2023,2024-01-12
"I appreciate that. Maybe a quickie on Services. Obviously, up 16% and a record is great. I don't know if you've dimensionalized how much was rate versus new business, but you have good core business momentum and a pipeline of won, but not yet funded. So I guess the question is, where can Services be over, let's say, the next two years in terms of growth, while rates come down, yet your businesses is winning new wins?",both,Glenn Schorr,Analyst,11,Q and A,Q4_2023,2024-01-12
"Yeah, sure. You want me to, sure.",both,Mark Mason,CFO,11,Q and A,Q4_2023,2024-01-12
"Yeah and I'll jump in, too. Let's maybe start with TTS. When we think about the performance of TTS, which, as we say, the growth this year up 19% ex-Argentina, came from a combination of both rates and the strong business actions we've taken. And you can see that in the different drivers. Cross-border was up 23%, commercial cards up 8%. In terms of the growth prospects, we've generated 22% in average revenue growth, from 21 to 23, well ahead of the Investor Day guidance we had of high-single digits. That was not just because of the rate cycle. It obviously helped. And we certainly expect to grow revenues at mid-single digit now as we lap the prior periods that benefited from those rate increases, and that's going to come from a few different areas.",both,Jane Fraser,CEO,11,Q and A,Q4_2023,2024-01-12
"One, the focus on our fee strategy, where we're capitalizing on strong client engagement, market-leading client solutions, and we're delivering on a lot of the different growth initiatives that we've been investing in across all our client segments. We'll continue optimizing our deposit book and bringing in high-quality deposits. And in a lower rate environment, GDP is typically higher, so you'd expect to see some higher growth in our capital-efficient payment volumes.",both,Jane Fraser,CEO,11,Q and A,Q4_2023,2024-01-12
"You'll see us continuing to acquire new clients and deepen relationships with existing clients. And I'd point to our confidence here, 27% increase in our new client acquisition this year and a sustained win/loss ratio of 82% on new deals, and that was across different client segments. And revenues from these clients just continues to ramp up, as we expand across the different geographies and product suites with them.",year,Jane Fraser,CEO,11,Q and A,Q4_2023,2024-01-12
"And you'll also continue to see us investing in the infrastructure and platforms we've been doing, launching new innovative products. And we're seeing momentum from some of the things we've recently done: Citi Token Services, Payment Express, 24/7 Clearing, et cetera. So I think, the main takeaway from TTS is that we'll continue to invest in it. We expect to see strong client momentum. We've been getting consistently good client feedback regarding our capabilities, so we expect to see good global growth that will certainly help as the rate cycle comes down. And it is a crown jewel for a reason.",both,Jane Fraser,CEO,11,Q and A,Q4_2023,2024-01-12
"And then, just quickly on Securities Services. I think where we're seeing, we mentioned, we've got a number of marquee wins there across all the client segments. That pipeline is both investors and issuers. And one of the core strategies that Okan put in place was to grow share with the US-based asset managers. We were at 2.6% share in 2020; we're now at 4.3%.",both,Jane Fraser,CEO,11,Q and A,Q4_2023,2024-01-12
"And a lot of the growth in the pipeline has been coming, not only from our global network names, but also from the marquee players in the US asset manager space. I think that's our ability to connect our capabilities that gives these players huge efficiencies for our clients.",both,Jane Fraser,CEO,11,Q and A,Q4_2023,2024-01-12
"Mark, anything I've missed there? You know I love this business.",both,Jane Fraser,CEO,11,Q and A,Q4_2023,2024-01-12
"As you should rightfully so, high-returning business, great growth prospects. To answer one of your questions, Glenn, about half of the NII growth, we could attribute to interest rates. And about half, I'd say, is business action, so us working with the clients to drive that momentum. And then, if you think about the noninterest revenue, for Services, they're up about 20% in the quarter year-over-year if you exclude the impact of the Argentina devaluation, and up 7% on a full year basis. And so, good momentum in the noninterest revenue growth as well.",both,Mark Mason,CFO,12,Q and A,Q4_2023,2024-01-12
Our next question comes from John McDonald with Autonomous Research. Your line is now open.,both,Operator,Host,12,Q and A,Q4_2023,2024-01-12
"Hi good morning. Mark, was hoping to ask you, how are you thinking about the pacing of capital build? Obviously, the Basel III proposals are out there, but they could change, of course. Even if they don't change, you have a couple of years to leg into those with the phase-ins and perhaps some mitigation opportunities. How should we think about you kind of building capital, given all those variables and the ability to buy back some stock along the way as you mentioned earlier?",both,John McDonald,Analyst,12,Q and A,Q4_2023,2024-01-12
"Sure, so look, John, obviously the Basel III proposal's still out there and under discussion. We've been very vocal about the potential impact of that. We've also been very disciplined about how we've been managing our capital. We've built that over 30 basis points over the course of the year. You've seen us actively manage that through the year, and we're going to continue to do that. We obviously generate earnings that contribute to that. We want to continue to drive growth across the business.",year,Mark Mason,CFO,12,Q and A,Q4_2023,2024-01-12
"We're trading at a 0.5 times book, where we can, we want to buy back as much as we can in shares. And we try to be disciplined about that over the past couple of quarters, doing that as a modest level. You heard me say, we're going to do that again this quarter at a modest level, but we have to be thoughtful about what those headwinds might look like. And we're actively working what mitigation actions we have to put in place, should it turn out closer to the way the current proposal sits.",both,Mark Mason,CFO,12,Q and A,Q4_2023,2024-01-12
"So, it's an ongoing active management that tries to balance servicing our client needs, with, obviously, holding a responsible amount of capital in light of the uncertainty that's out there, and with an eye towards buybacks where we can do that.",both,Mark Mason,CFO,12,Q and A,Q4_2023,2024-01-12
"Okay. And just as an expense follow-up, I wasn't clear. Has the transformation spend peaked, when you think about what you'll spend on transformation this year versus last year? And are the transformation benefits starting to kick in at this point?",both,John McDonald,Analyst,12,Q and A,Q4_2023,2024-01-12
"Yeah. So to be clear, we're going to continue to spend whatever we need to spend on the transformation and on risk and controls. And so, we did see a tick up this year. We've got a plan for 2024, and if we've got to spend a bit more than we spent this year, we're going to spend more. That's what the plan calls for, and so that's what we'll do. That's inside of the number that I've given you for guidance, all right. And so, that's important for us. I think it will drive, obviously, operational improvement and saves down the line.",both,Mark Mason,CFO,12,Q and A,Q4_2023,2024-01-12
"It is part of the $2 billion to $2.5 billion, but that is the early stage, if you will, of the transformation spend paying back. I think as we talked about at Investor Day, frankly, we'll continue to see expense benefits beyond the medium term from some of this transformation investment that we've been making. And so, I would think of the medium term as the start of the benefits that we'll see from the investments we've been making in transformation and risk and controls.",both,Mark Mason,CFO,12,Q and A,Q4_2023,2024-01-12
"Yeah. I think, Mark, you're spot on. So we'll continue making the investments we need to in the transformation. It's a multi-year journey, as we've always been clear around this, ultimately, with benefits to the shareholders. And more of the expense saves that we've been talking about are, I'd separate out transformation from sort of the operating expense base of our businesses, which we want to make sure is as productive and as effective as possible.",both,Jane Fraser,CEO,12,Q and A,Q4_2023,2024-01-12
"And the types of benefits we're seeing. This is the second year in a row that we've retired 6% of our legacy platform base. And you've heard me talking about moving 20 of our cash equity platforms on to 1, 6 reporting ledgers on to 1, 11 sanctioned platforms on to 1. So we start seeing some of the benefits of those come in.",year,Jane Fraser,CEO,13,Q and A,Q4_2023,2024-01-12
"Other things, we automated independent price verification for 90% of our prioritized fixed income and equity securities. That's reduced manual controls. That's improved valuation consistency. That's also had an impact on the efficiency of the business.",year,Jane Fraser,CEO,13,Q and A,Q4_2023,2024-01-12
We've loaded 98% of our prioritized wholesale and consumer data into two authorized repositories. That will also begin to start having some benefits for us.,year,Jane Fraser,CEO,13,Q and A,Q4_2023,2024-01-12
"So there is a cumulative effect that is beginning to build now from all the work we've done, but it will take some time to really kick into the, as Mark said, when you really feel it, is a few years out. But we'll keep giving you the proof points of things as we're going, so it's not a just trust us that it’ s coming, you'll begin to see it build.",both,Jane Fraser,CEO,13,Q and A,Q4_2023,2024-01-12
Our next question will come from Jim Mitchell with Seaport Global. Your line is now open.,both,Operator,Host,13,Q and A,Q4_2023,2024-01-12
"Hey, good afternoon. Mark, maybe just to follow up on the expense, slide 22, where you talk about $2 billion to $2.5 billion of expense saves. I guess I'm struggling with the numbers there. I think if you look at exit and wind- down markets, you're probably close to $2 billion in numbers there. And maybe the stranded costs, you can't get all of that out. You're doing about –  severance is $700 million to $1 billion in 2024. So doesn't seem like there's a ton of actual cost saves in that number. And just maybe I'm wrong, if you could just kind of walk me through the numbers embedded in there and if there's, you've kind of eluded to more to come beyond the intermediate term.",both,Jim Mitchell,Analyst,13,Q and A,Q4_2023,2024-01-12
"Yeah, I think the thing I'd point out to you is a couple things. One, obviously, we're forecasting revenue growth over this period of time. And so, there's going to be volume-related expenses associated with that.",both,Mark Mason,CFO,13,Q and A,Q4_2023,2024-01-12
"The second thing I'd point out, as I just mentioned to the prior question, is that we're continuing to invest in risk and controls and in the transformation over this period of time.",both,Mark Mason,CFO,13,Q and A,Q4_2023,2024-01-12
"And so, what you see is there's an increase in expenses associated with at least those two things. And that's offset by the savings that we're starting to generate, particularly from the org simplification that Jane has talked about, as well as from the stranded cost reduction that will continue to play out, as well as from some of the rightsizing of businesses that we've referenced in some of the prepared remarks.",both,Mark Mason,CFO,13,Q and A,Q4_2023,2024-01-12
"And then the final point that I'd make is if I look at this medium-term number of $51 billion to $53 billion that still has Mexico in it and one of the other pages we'd point to, expenses around Mexico. But because of where we are, we'll be in the IPO process, that's still going to be part of this expense base, and so you can't lose sight of that.",both,Mark Mason,CFO,13,Q and A,Q4_2023,2024-01-12
"Well, that's an important clarification that the $2 billion to $2.5 billion includes revenue-related volume growth, so that's helpful. And then, just maybe the other, on the slides talking about revenue targets. One of the big numbers not talked about was Markets. How are you thinking, volatility has come in, macro picture’ s getting better, maybe that mutes volatility, how do you think about that business in 2024 as it relates to your guidance?",both,Jim Mitchell,Analyst,13,Q and A,Q4_2023,2024-01-12
"As you know, it's a tough business to forecast, certainly, for a full year, and in some instances for a quarter, and so, we've basically kind of backed that out but we assume markets kind of flat to modestly down, but we've backed it out, and it's roughly flat. Not of the $80 billion to $81 billion, right, you see the guidance of NIR ex- Markets and NII ex-Markets, so in the $80 billion to $81 billion, we've assumed it roughly flat.",both,Mark Mason,CFO,13,Q and A,Q4_2023,2024-01-12
"Okay, great. Thank you.",both,Jim Mitchell,Analyst,14,Q and A,Q4_2023,2024-01-12
Our next question will come from Ebrahim Poonawala with Bank of America. Your line is now open.,both,Operator,Host,14,Q and A,Q4_2023,2024-01-12
"Morning, afternoon, Jane. Just wanted to follow up on something I think Mark said at the end of his very first response around, it's very hard in my seat to figure out whether you're going to grow revenues or shrink revenues given the macro. Should we take it based on what you've said today as we look into 2026 getting to that 11% RoTCE, if for whatever reason, revenue falls short and you feel good about the expense flex to mitigate that headwind?",both,Ebrahim Poonawala,Analyst,14,Q and A,Q4_2023,2024-01-12
"It's Jane, obviously. I want to just jump in on one bit, which is we are committed and we're very confident around the 4% to 5% revenue growth rate, so there isn't any backing away from that number. And that's in various macro environments, et cetera. And as we look across the different businesses, and the projections we have, we're confident around that. Obviously, if there's a very adverse macro environment, et cetera, we've got other levers we can take, but Mark, let me pass it to you.",both,Jane Fraser,CEO,14,Q and A,Q4_2023,2024-01-12
"And by no means was I trying to suggest that we weren't confident in the forecast for the top line. If you think about the strategy and the strength of those five core businesses, we've got a lot of conviction around that. With that said, as you point out, Jane, under a circumstance where that doesn't play out, there are obviously volume-related incentive comp expenses and the like that would naturally come down. We'd ensure that they came down with the revenue decline or shortfall. And then we'd recalibrate other spend, other investments, spend not related to risk and controls and transformation, but other investments across the platform, we'd recalibrate accordingly.",both,Mark Mason,CFO,14,Q and A,Q4_2023,2024-01-12
"Well said. Just what I needed. And one quick question. As we think about rightsizing the Markets business, there have been headlines around the muni and the distressed business that you've gotten out. Is there a risk where the Markets business becomes too small and you lag the scale to be sort of efficient and relevant in certain, or just across the breadth of, be it, fixed income or equities? Just if you can talk about that. Thank you.",both,Ebrahim Poonawala,Analyst,14,Q and A,Q4_2023,2024-01-12
"The short answer is no. If you think about our Markets business, we have four businesses, each of which are around sort of $4 billion or so in size. You have our global FX network, where we're typically number one in any year, just given the strength, and particularly, the corporate client base we've set off. Rates, typically top three. Together, these are two of the largest macro pools within FICC.",both,Jane Fraser,CEO,14,Q and A,Q4_2023,2024-01-12
"In terms of the spread products, we've been putting our financing and securitization business as part of our simplification, fully within Markets, so that we've created a unified, scaled spreads product business. And then finally, equities, where we're focused on improving our prime offering, building balances. We still have a way to go obviously in that. Prime balances we're pleased they were nicely up this year, driven by client momentum. And we're a leading equities derivative franchise. So, you do have these four core businesses.",both,Jane Fraser,CEO,14,Q and A,Q4_2023,2024-01-12
"And I'd go back to our big point of differentiation and why we feel we're well-positioned. We have a very differentiated corporate client base and very strong partnerships between our core Markets franchise, TTS, and Banking and Securities Services, and that helps us in FX, in commodities and in rates around the world. So, Markets is important both in terms of its leadership, but also, how it fits into the strengths that we have from this simpler Citi of those five core interconnected businesses.",both,Jane Fraser,CEO,14,Q and A,Q4_2023,2024-01-12
"We've demonstrated solid returns in the past. I think a lot of the actions we've been taking will help drive returns in the future. And you should be getting confidence when you see the discipline we're putting on to RWA, 5.3%, getting close that target, we said at Investor Day. We're moving that up to 6%. The exits we've got of nonstrategic businesses shows our focus on efficiency. And we've also been doing some good investments in our technology, and that's getting us into a good place there. So, I think, don't be concerned about the shrinking. We're just making sure that it really plays to our strengths and we optimize the returns.",both,Jane Fraser,CEO,15,Q and A,Q4_2023,2024-01-12
Our next question will come from Gerard Cassidy with RBC. Your line is now open.,both,Operator,Host,15,Q and A,Q4_2023,2024-01-12
"Good afternoon, Mark, Jane. Mark, can you share with us, in your revenue guide, in the net interest income, I know you mentioned it's going to be lower and part of it is due to lower interest rates. Some of your peers have come out with their guides using the forward curve in their net interest income forecast which includes the Fed in our country, six cuts. Can you give us some color what kind of rate environment, I know you said lower rates, but any insights around that guide?",both,Gerard Cassidy,Analyst,15,Q and A,Q4_2023,2024-01-12
"Yeah, I think what I'd point you to is in the range of the $80 billion to $81 billion, we're assuming three to six cuts, right. You've got a range there and the reason I described it like that is that, if you think about our IRE, as we've shown it in the Qs before, we're positioned such that, with 100 basis point move, parallel shift in rate across the curve, the US dollar impact would only be a couple hundred million dollars, all right, and so, to the negative, obviously, but it's a couple hundred million dollars. And so as we think about that forecast, and as I mentioned, NII being down a bit, that covers kind of three to six cuts over the course of 2024, likely back-loaded, but that's what's in there.",both,Mark Mason,CFO,15,Q and A,Q4_2023,2024-01-12
"Very good, I appreciate that. And then, Jane, more of a qualitative question rather than quantitative, but obviously, there's numerous moving parts of the strategies that you guys are executing on, exiting businesses, downsizing businesses. Especially on the downsizing, I think you guys mentioned, the head count of about 20,000 coming down. How do you keep the morale of the organization elevated when you have these types of tough decisions that you all have to make?",both,Gerard Cassidy,Analyst,15,Q and A,Q4_2023,2024-01-12
"Yes. Well, we've also got areas which are growing, so that does help, too. We have a diversified portfolio here. I think we're very mindful of, that there is a human impact of the decisions that we're making. We're trying to be as transparent with our people, as we are with our investors about what we need to do, why we're doing it, what to expect and laying that out so people understand the logic behind the decisions, and then they understand what the decisions are as quickly as they can. I think that's the most humane way to do this.",both,Jane Fraser,CEO,15,Q and A,Q4_2023,2024-01-12
Our next question comes from Erika Najarian with UBS. Your line is now open.,both,Operator,Host,15,Q and A,Q4_2023,2024-01-12
"Hi. I'm sorry to prolong the call. Thank you for all your color. Just one more question. Jane, when will you feel comfortable giving us a buyback outlook that's beyond just fourth quarter? I know you still have a little bit of ways to go, but you do have 100 basis point buffer to your minimum. And I know Basel III endgame is still out there, and I'm sure that reducing risk just doesn't mean expenses, but also reducing your – or being mindful of your RWA footprint. And given where your stock is relative to book, when will you be more comfortable about giving sort of a longer-term outlook that was underpinning your RoTCE target with regards to the buyback?",both,Erika Najarian,Analyst,15,Q and A,Q4_2023,2024-01-12
"Erika, it's a great question. It's one I ask myself every morning when I get up, because given where we trade, the value for our shareholders of buybacks is enormous. And Mark and I are very committed to doing so. We also know that we're building our credibility. And I don't want to say things that we're not going to deliver against, although we're going to have to change. I think it's one of the values that we're really trying to adhere to very strongly.",both,Jane Fraser,CEO,15,Q and A,Q4_2023,2024-01-12
