text,fiscal_period_ref,speaker,role,page,section,reporting_period,date_of_call
"Morning, Jim.",quarter,Brian Moynihan,CEO,35,Q and A,Q1_2024,2024-04-16
"Hey. Good morning. Maybe just one last follow-up on that last question from Gerard. If Basel III is reduced, as Powell suggested, is it with limited loan growth just more likely to be put toward buybacks? Or do you see opportunities beyond just loan growth, whether it's building -- growing the trading balance sheet or other opportunities to deploy that capital to drive growth? Just curious how you deploy that.",quarter,Jim Mitchell,Analyst,35,Q and A,Q1_2024,2024-04-16
"Well, number one, our primary interest is to use the capital to support our customer businesses. So you've seen that happen in the markets business. As we said, it was one of the best quarters in a decade first quarters. That is a multiyear process of building up not only the balance sheet and capital committed to the business, but importantly also, the investment systems and technology and risk management and other things, if they continue to make money almost every trading day over the last several years.",quarter,Brian Moynihan,CEO,36,Q and A,Q1_2024,2024-04-16
"So that's where we'd like to use it, supporting that business, supporting loan business, supporting all the businesses. The reality is, it's outside of the capital markets business, then you go to loan growth. And that -- and the kind of loan growth in mid-single digits, that doesn't eat a lot of the capital up. So that is just there to be returned.",quarter,Brian Moynihan,CEO,36,Q and A,Q1_2024,2024-04-16
"And so we got two basic phenomena. One is we storehoused a bunch of capital. If you think about the last few years between the changes in CCAR a few years ago, that changed the capital dimension then the proposed rules, and then now whatever happens with them. So they were sort of sitting in pandemic.",quarter,Brian Moynihan,CEO,36,Q and A,Q1_2024,2024-04-16
"Before that, we were sitting on a fair amount of capital. That should be released over time here. And then secondly, the question will be what those rules are going forward. And then third would be what do you need to support the business, which again, that's our primary responsibility.",quarter,Brian Moynihan,CEO,36,Q and A,Q1_2024,2024-04-16
"But generally, that is a modest amount of capital. And so most of our desire is really deploying more expenses and technology investments, and we've gone from $3 billion to $3.8 billion in annual technology investments across the last couple of years, more branches. But that's more of an expense question than a capital question. All right.",quarter,Brian Moynihan,CEO,36,Q and A,Q1_2024,2024-04-16
"I think that's all Lee, correct? OK. Why don't we wrap it up here? Thank you for your time and attention. This quarter marks another quarter of strong organic growth across every businesses, continued this quarter. Good fees and what we call fees and commissions in the wealth management business, investment banking, and trading.",quarter,Brian Moynihan,CEO,37,Conclusion,Q1_2024,2024-04-16
"NII continues to outperform what we told you last quarter for the quarter, first quarter. We rolled that into second quarter, and we expect continued performance in that as we go through the trough and meet the second half of the year. We continue to manage expenses well into the inflation rate, and we start with strong capital and liquidity and a strong balance sheet.",quarter,Brian Moynihan,CEO,37,Conclusion,Q1_2024,2024-04-16
"So we are -- the team did a great job this quarter, and we look forward to talking to you next quarter. Thank you.",quarter,Brian Moynihan,CEO,37,Conclusion,Q1_2024,2024-04-16
[Operator signoff],quarter,Operator,Host,37,Conclusion,Q1_2024,2024-04-16
