text,fiscal_period_ref,speaker,role,page,section,reporting_period,date_of_call
"And we'll use Slide 10 for that discussion, where we reported $17.2 billion expense this quarter, including the FDIC assessment. Adjusted for the assessment, expenses were $16.5 billion, and the increase over the fourth quarter included a little more than $400 million in seasonal payroll tax expense as well as higher revenue-related costs and, to a lesser extent, annual merit increases and other annual awards like sharing success awards provided this quarter.",quarter,Alastair Borthwick,CFO,11,Prepared remarks,Q1_2024,2024-04-16
"$16.5 billion was just a little above our forecast for Q1, which we made last quarter, and the increase is driven by better-than-expected fee revenue across wealth management, investment banking and sales and trading.",quarter,Alastair Borthwick,CFO,11,Prepared remarks,Q1_2024,2024-04-16
"And as Brian said, that's a trade-off we're more than happy to make, bringing more earnings to the bottom line. And while expense is up almost 2% from last year, we simply remind you, inflation was up by more than 4%, and we've increased our investment and we're paying for the revenue growth. So we think it represents good work by our teams.",quarter,Alastair Borthwick,CFO,11,Prepared remarks,Q1_2024,2024-04-16
"As we look forward in Q2, we expect a decline from the Q1 level, as we typically see about two-thirds of the Q1 elevated payroll tax expense come back out.",quarter,Alastair Borthwick,CFO,11,Prepared remarks,Q1_2024,2024-04-16
"And the remainder of the year, expense is expected to trend down. Continued digital engagement, savings, and operational excellence initiatives should help us offset other cost increases for people and technology through the back half of the year.",quarter,Alastair Borthwick,CFO,11,Prepared remarks,Q1_2024,2024-04-16
"Turning to credit on Slide 11. Provision expense was $1.3 billion in the first quarter, and that included $179 million of reserve release due to a modestly improved macro environmental outlook, as the baseline consensus expectations improved from the fourth quarter.",quarter,Alastair Borthwick,CFO,11,Prepared remarks,Q1_2024,2024-04-16
"On a weighted basis, we remain reserved for an unemployment rate of nearly 5% by the end of 2025 compared to the most recent actual 3.8% rate.",quarter,Alastair Borthwick,CFO,12,Prepared remarks,Q1_2024,2024-04-16
"Net charge-offs of $1.5 billion increased $306 million from the fourth quarter, driven by continued credit card seasoning and commercial real estate office exposures, as swift revaluations from current appraisals and resolutions drove higher charge-offs. The net charge-off ratio was 58 basis points, a 13 basis point increase from the fourth quarter.",quarter,Alastair Borthwick,CFO,12,Prepared remarks,Q1_2024,2024-04-16
"On Slide 12, we show you the credit quality metrics for both our consumer and commercial portfolios.",quarter,Alastair Borthwick,CFO,12,Prepared remarks,Q1_2024,2024-04-16
Consumer net charge-offs increased $115 million versus the fourth quarter from the flow-through of higher late-stage credit card delinquencies. We included a credit card delinquency Slide number 28 in our appendix. And we're encouraged by the trend of delinquencies because the late-stage increases slowed and early stage delinquencies improved as well.,quarter,Alastair Borthwick,CFO,12,Prepared remarks,Q1_2024,2024-04-16
And that leads us to believe we should begin to see consumer net charge-offs start to level out over the next quarter or so.,quarter,Alastair Borthwick,CFO,12,Prepared remarks,Q1_2024,2024-04-16
"All of this is still well within our risk appetite and our expectations, and it's consistent with the normalization of credit we've discussed with you in prior calls. Commercial net charge-offs increased $191 million versus the fourth quarter, driven by commercial real estate losses and office exposures.",quarter,Alastair Borthwick,CFO,12,Prepared remarks,Q1_2024,2024-04-16
"And on office losses this quarter, we recorded charge-offs on 16 office loans: four were a result of sales activity, i.e., final resolution; seven were from losses that we expect on exposures that are in the process of expected resolution in the course of the next 90 days; and the rest we took as a result of refreshed valuations.",quarter,Alastair Borthwick,CFO,12,Prepared remarks,Q1_2024,2024-04-16
"Using a continuous and thorough loan-by-loan analysis, and we're quick to recognize impacts in the commercial real estate office space through our risk ratings, and that's resulted in several downgrades in the last few quarters.",quarter,Alastair Borthwick,CFO,12,Prepared remarks,Q1_2024,2024-04-16
"As a result of these quick actions and our downgrades in categorization, we've also refreshed the valuation of our reservable criticized properties, and we've taken appropriate reserves and charge-offs in the process.",quarter,Alastair Borthwick,CFO,12,Prepared remarks,Q1_2024,2024-04-16
"Roughly one-third of our office exposure is now categorized as reservable criticized. And importantly, the pace of the increase in reservable criticized exposures has slowed each quarter since the second quarter of last year. So we believe the losses on these office properties have been front-loaded and largely reserved.",quarter,Alastair Borthwick,CFO,13,Prepared remarks,Q1_2024,2024-04-16
"We expect the losses to move lower in the second quarter. And we expect a notable decline in the second half of the year when compared to the first half of this year, absent any material change in expected real estate prices. In the appendix on Slide 29, we've included a current view of our commercial real estate and office portfolio metrics, as we usually do. OK.",quarter,Alastair Borthwick,CFO,13,Prepared remarks,Q1_2024,2024-04-16
"Let's turn to the various lines of business and offer some brief comments on their results, starting on Slide 13 with Consumer Banking. For the quarter, Consumer Banking earned $2.7 billion on continued strong organic growth.",quarter,Alastair Borthwick,CFO,13,Prepared remarks,Q1_2024,2024-04-16
The reported earnings declined 15% year over year as revenue declined from lower deposit balances compared to the first quarter of '23. Credit card loss normalization also caused year-over-year provision expense to increase.,quarter,Alastair Borthwick,CFO,13,Prepared remarks,Q1_2024,2024-04-16
"As Brian noted, customer activity showed another strong quarter of net new checking growth, another strong period of card openings, and investment balances for consumer clients, which climbed 29% year over year to a record $456 billion. That included market appreciation and also very strong full-year flows of $44 billion.",quarter,Alastair Borthwick,CFO,13,Prepared remarks,Q1_2024,2024-04-16
"As noted earlier, loans grew nicely year over year from credit card as well as small business where we remain the industry leader.",quarter,Alastair Borthwick,CFO,13,Prepared remarks,Q1_2024,2024-04-16
"Expenses were flat year over year, fighting off inflation, merit increases, higher minimum wages, and new and renovated financial centers and technology investments.",quarter,Alastair Borthwick,CFO,13,Prepared remarks,Q1_2024,2024-04-16
"So holding expense flat reflected very good work by the consumer team. As you can see on the appendix, Page 20, digital adoption and engagement continued to improve, reaching a record of 3.4 billion digital log-ins in the quarter, and it showed good year-over-year improvement. Customer satisfaction scores at near-record levels illustrate the continued appreciation of the enhanced capabilities we provide.",quarter,Alastair Borthwick,CFO,13,Prepared remarks,Q1_2024,2024-04-16
Moving to wealth management on Slide 14.,quarter,Alastair Borthwick,CFO,14,Prepared remarks,Q1_2024,2024-04-16
"We produced good results, and that included good organic client activity, market favorability, and strong flows. Our comprehensive suite of investment and advisory services, coupled with a commitment to personalized wealth management planning and solutions, has enabled us to meet the diverse needs and aspirations of our clients.",quarter,Alastair Borthwick,CFO,14,Prepared remarks,Q1_2024,2024-04-16
"In the first quarter, we reported record revenue of $5.6 billion and a little more than $1 billion in net income. That net income rose 10% from the first quarter of '23.",quarter,Alastair Borthwick,CFO,14,Prepared remarks,Q1_2024,2024-04-16
"Business generated positive operating leverage and grew revenue faster than expense, while improving the pre-tax margin year over year. While overall average loans were down year over year driven by the securities-based lending, it's worth noting the strong growth we're seeing in custom lending, and ending loans in the wealth management customer loan book are up 6% year over year.",quarter,Alastair Borthwick,CFO,14,Prepared remarks,Q1_2024,2024-04-16
"As Brian noted earlier, both Merrill and the Private Bank continued to see strong organic growth and produced good assets under management flows of more than $60 billion since the first quarter of '23, which reflects a good mix of new client money as well as existing clients putting money to work.",quarter,Alastair Borthwick,CFO,14,Prepared remarks,Q1_2024,2024-04-16
"Expense growth here max the revenue growth, otherwise fighting off higher investment costs and inflation.",quarter,Alastair Borthwick,CFO,14,Prepared remarks,Q1_2024,2024-04-16
"Let me also highlight the continued digital momentum here. As an example, Merrill has 86% of its clients now engaging with us digitally and 80% utilizing eDelivery. 76% of their eligible accounts are now opened digitally. So the cost for us to open is half, and the customer cycle times are improved greatly.",quarter,Alastair Borthwick,CFO,14,Prepared remarks,Q1_2024,2024-04-16
"On Slide 15, you see Global Banking results. And the business produced earnings of just less than $2 billion, down 22% year over year, as improved investment banking fees and treasury services revenue were overcome by lower net interest income and higher provision expense.",quarter,Alastair Borthwick,CFO,14,Prepared remarks,Q1_2024,2024-04-16
"Revenue declined 4%, driven by the impact of interest rates and deposit rotation to interest-bearing, and that impacted NII. The diversification of our revenue across products and regions continues to reflect the strength of this platform, and GTS and investment banking fees are good examples.",quarter,Alastair Borthwick,CFO,14,Prepared remarks,Q1_2024,2024-04-16
"In our Global Treasury Services business, some of the NII pressure from higher rates on deposits is offset by the fees paid for moving and managing the cash of clients, and that continues to grow with existing clients as well as with new client generation.",quarter,Alastair Borthwick,CFO,15,Prepared remarks,Q1_2024,2024-04-16
"As Brian noted, Investment Banking had a strong quarter. And at $1.6 billion in investment banking fees, this quarter was the strongest quarter in seven years, absent the pandemic 2020 and 2021 periods.",quarter,Alastair Borthwick,CFO,15,Prepared remarks,Q1_2024,2024-04-16
An increase in provision expense included the commercial real estate net charge-offs I discussed earlier as well as a larger reserve release in the prior year period.,quarter,Alastair Borthwick,CFO,15,Prepared remarks,Q1_2024,2024-04-16
"Expense increased 2% year over year, including the 35% lift in investment banking fees from the first quarter of '23. Switching to Global Markets on Slide 16.",quarter,Alastair Borthwick,CFO,15,Prepared remarks,Q1_2024,2024-04-16
"We'll focus our comments on results, excluding DVA, as we normally do. The team had another terrific quarter with $1.8 billion in earnings, growing 7% year over year.",quarter,Alastair Borthwick,CFO,15,Prepared remarks,Q1_2024,2024-04-16
"Revenue improved 6% from the first quarter of '23, and return on average allocated capital was 16%. Focusing on sales and trading ex DVA. Revenue improved 2% year over year to $5.2 billion, which is the highest first-quarter result in over a decade.",quarter,Alastair Borthwick,CFO,15,Prepared remarks,Q1_2024,2024-04-16
"FICC was down 4%, while equities increased 15% compared to the first quarter of '23.",quarter,Alastair Borthwick,CFO,15,Prepared remarks,Q1_2024,2024-04-16
"And the decline in the FICC revenues versus the first quarter was driven by a weaker macro trading quarter that was partially offset by better mortgage trading results. Equities was driven by strong trading results in derivatives, and year-over-year expenses were up 4% on continued investment in the business.",quarter,Alastair Borthwick,CFO,15,Prepared remarks,Q1_2024,2024-04-16
"Finally, and on Slide 17, All Other shows a loss of $700 million, driven by the FDIC assessment. Revenue declined year over year, reflecting higher investment tax credit deals.",quarter,Alastair Borthwick,CFO,15,Prepared remarks,Q1_2024,2024-04-16
"And expense, adjusted for the FDIC assessment, was down $113 million, driven by lower unemployment processing costs. Our effective tax rate for the quarter was 8%.",quarter,Alastair Borthwick,CFO,15,Prepared remarks,Q1_2024,2024-04-16
"And excluding the FDIC assessment and other discrete items, it would have been 9%. And further excluding tax credits related to investments in renewable energy and affordable housing, our effective tax rate would have been 26%.",quarter,Alastair Borthwick,CFO,16,Prepared remarks,Q1_2024,2024-04-16
"Thank you. And with that, we'll jump into Q&A.",quarter,Alastair Borthwick,CFO,16,Prepared remarks,Q1_2024,2024-04-16
[Operator instructions] We'll take our first question from Steven Chubak of Wolfe Research.,quarter,Operator,Host,16,Q and A,Q1_2024,2024-04-16
Hey. Good morning.,quarter,Steven Chubak,Analyst,16,Q and A,Q1_2024,2024-04-16
Good morning Steven.,quarter,Alastair Borthwick,CFO,16,Q and A,Q1_2024,2024-04-16
"So maybe just to start off with a question on capital management. Just given the strength of your excess capital position, there may be still some uncertainty around Basel III endgame and where the proposal could ultimately shake out. I was hoping you could just speak to where you're comfortable running on CET1. And when can we expect that you'll return to 100%-plus type payout?",quarter,Steven Chubak,Analyst,16,Q and A,Q1_2024,2024-04-16
"I think you should expect that we run a cushion. Whatever rules come out and when they come out and get clarity, we'll expect to run the requirements plus 50 basis points up to 100 basis points of excess. And anything above that will be either used to continue to grow the company, if needed. If not, it will be returned.",quarter,Brian Moynihan,CEO,17,Q and A,Q1_2024,2024-04-16
"And so we're just -- as all of us are waiting for the finalization of these rules, right now we're sitting on $30 billion under the old rules. We have enough under the new rules as previously proposed. But obviously, they're talking about changing them. So you should expect clarity on that.",quarter,Brian Moynihan,CEO,17,Q and A,Q1_2024,2024-04-16
"What you also expect is, as we think about it beginning now, you're basically at the point where you're sitting on the capital, the very modest need to build a cushion to the rules as proposed and any changes will be more favorable, that I assume. So expect us to continue to return capital at a fairly strong rate as we move through the second quarter and beyond and the rules become clarified.",quarter,Brian Moynihan,CEO,17,Q and A,Q1_2024,2024-04-16
"Great color, Brian. And for my follow-up, just on the NII commentary. Alastair, it sounds like you're still assuming some modest deposit growth in the back half as part of that NII trajectory, that recovery off the trough in 2Q. Just given your deposit balances increased $500 billion since COVID, I know some of that's going to be a function of share gains.",quarter,Steven Chubak,Analyst,17,Q and A,Q1_2024,2024-04-16
"But as we prepare for some Q2-driven outflows, how are you handicapping the risk of deposit attrition? And how does that impact the NII guidance? If you can frame any sort of sensitivity, recognizing many of those tend to be hot money or higher-cost deposits.",quarter,Steven Chubak,Analyst,17,Q and A,Q1_2024,2024-04-16
"Yes. So first thing, I would just say, Steven, is we've been up against Q2 now for the last couple of years. So the deposits are beginning to settle in now.",quarter,Alastair Borthwick,CFO,17,Q and A,Q1_2024,2024-04-16
"And if we were to go back to -- if you take, for example, consumer, if you were to go back to pre-pandemic and think about what long-term sustainable growth rates look like for consumer, if you just extended that through from the fourth quarter of 2019 to today, given that the economy is 30% larger, we kind of feel like consumer is approaching that floor.",quarter,Alastair Borthwick,CFO,18,Q and A,Q1_2024,2024-04-16
"So we're still in this belief that Q2 is going to be -- Q3 may be the turning point for consumer. You can see that slowing though. The rest of our business, if you look at the exhibit we put together on deposits, if you look at that bottom left chart on wealth, you'll see it slowed and grew this quarter. And then in Global Banking on the right-hand side of that page, they're kind of back to pre-pandemic growth rates.",quarter,Alastair Borthwick,CFO,18,Q and A,Q1_2024,2024-04-16
"They're up 7% year over year. So we're seeing some structure now in the deposit base. Even with Q2 over the course of the past year, our deposits were up $100 billion. So it has been a point of conviction of ours that, as we get toward Q2, we should see the consumer side begin to stabilize.",quarter,Alastair Borthwick,CFO,18,Q and A,Q1_2024,2024-04-16
That's what's driving our conviction that NII will go up in Q3 and Q4. We're in that transition period right now.,quarter,Alastair Borthwick,CFO,18,Q and A,Q1_2024,2024-04-16
Good color. Thanks so much for taking my questions.,quarter,Steven Chubak,Analyst,18,Q and A,Q1_2024,2024-04-16
We'll take our next question from Mike Mayo of Wells Fargo.,quarter,Operator,Host,18,Q and A,Q1_2024,2024-04-16
"Hi. Well, thanks for the outlook for NII and then consumer charge-offs. But once again, I go back to efficiency. And you highlight the 2 billion Erica interactions, the last 1 billion in the last 18 months.",quarter,Mike Mayo,Analyst,18,Q and A,Q1_2024,2024-04-16
"You mentioned Zelle, transaction now double the check, transactions are more than checks plus cash withdrawals from ATMs plus cash withdrawal from tellers. So for all the great tech work, the efficiency ratio improved 66% to 64% quarter over quarter. But I know you're still not happy with that 64%. So as you see the NII decline in site and as you have this tech evolutions continuing, when do you think you can get below a 60% efficiency ratio? What's your outlook for that? Because I'm just reconciling the numbers that we look at with all the progress you're making internally.",quarter,Mike Mayo,Analyst,19,Q and A,Q1_2024,2024-04-16
"Mike, I think as NII sort of moves along the path that Alastair mentioned, all that sort of flows through because there's no more activity it touches, as you're pointing out, and we continue to reduce marginal expense of that activity because largely, that's a consumer and wealth management and Global Banking, which don't add lots more clients and stuff and lots more activity. Even though the numbers go up, it's out of efficiency. So that continue to improve our efficiency ratio.",quarter,Brian Moynihan,CEO,19,Q and A,Q1_2024,2024-04-16
"As you also well know, when the revenue growth is coming through the wealth management business, which, by definition, because of the way the compensation process works, has the lowest efficiency ratio in the company, that's a good thing.",quarter,Brian Moynihan,CEO,19,Q and A,Q1_2024,2024-04-16
"Because it grows and we get good profitability growth out of it, but we're fighting that trend. And as one of the largest wealth management business in the world, if not, it's a higher percentage of our revenues and our expense base. And so we'll continue to drive it down. We're at 64%.",quarter,Brian Moynihan,CEO,19,Q and A,Q1_2024,2024-04-16
"You'd expect that to improve as the deposit balance has stabilized and for many quarters now and starting to grow. The rate paid has really flattened out sequentially by quarter, and the yield of the portfolio and the yield of the assets continue to grow. So we feel good about how it's going. Our focus is really on deploying expenses in operating leverage.",quarter,Brian Moynihan,CEO,19,Q and A,Q1_2024,2024-04-16
"And as we get through the twist in the NII, you should start to see us return to that again. And that would then obviously drive down the efficiency ratio.",quarter,Brian Moynihan,CEO,19,Q and A,Q1_2024,2024-04-16
"What are you thinking about expense growth for the rest of the year or next year? For a while there, you're trying -- and I get it, inflation has gone up quite a bit. But what are your thoughts about expense growth looking ahead?",quarter,Mike Mayo,Analyst,20,Q and A,Q1_2024,2024-04-16
"Well, last year, remember, Mike, we told you we thought we could drive expense down every quarter. We believe this year, the expense will trend down over the course of this year. And obviously, Q1 has inflated a little bit with just payroll tax and some of the revenue seasonality. But underneath that, there's pretty significant revenue strength.",quarter,Alastair Borthwick,CFO,20,Q and A,Q1_2024,2024-04-16
"So I think that probably cost us $100 million or so this quarter. I think we probably are looking -- if this environment continues, we're looking at another $100 million per quarter going forward. But it's -- to Brian's point, it's the good expense that comes with revenue growth over time. That's really the only change, I'd say, with respect to how we think about the expense picture.",quarter,Alastair Borthwick,CFO,20,Q and A,Q1_2024,2024-04-16
All right. Thank you.,quarter,Mike Mayo,Analyst,20,Q and A,Q1_2024,2024-04-16
We'll take our next question from John McDonald of Autonomous Research.,quarter,Operator,Host,20,Q and A,Q1_2024,2024-04-16
"Thanks, good morning. I wanted to follow up on the helpful deposit commentary, Alastair. So you mentioned the consumer. You're thinking that that will stabilize in the back half of the year on deposits.",quarter,John McDonald,Analyst,20,Q and A,Q1_2024,2024-04-16
"Wondering what your mix shift expectations are. Earlier this year, you kind of thought that those customers had moved for rate seeking, already had. I'm just wondering if higher rates for longer could put some pressure on rate-seeking behavior again. And what you're baking in, in terms of mix shift from noninterest-bearing.",quarter,John McDonald,Analyst,21,Q and A,Q1_2024,2024-04-16
Is interest-bearing in your outlook and your planning?,quarter,John McDonald,Analyst,21,Q and A,Q1_2024,2024-04-16
"Yes, John, I think if you look at seven, you could see sort of the mix in the left-hand corner. Remember that one of the things people have to -- we all have to be careful about is in the Global Banking area, the way the fees are paid and earnings credit. It messes up the simplicity of noninterest-bearing and interest-bearing, so it's complex.",quarter,Brian Moynihan,CEO,21,Q and A,Q1_2024,2024-04-16
"But if you look at the quarters coming across from the first quarter of '23 through the first quarter of '24, you can see that -- you're seeing the rate of change slow dramatically and kind of settle in.",quarter,Brian Moynihan,CEO,21,Q and A,Q1_2024,2024-04-16
"So I don't -- a lot of the money has moved in -- if you look at the seven-day average for consumer go all the way back to the early part of October, it's been relatively stable at $950 billion, $960 billion. So we're just getting to the tax seasons and ins and outs in the wealth management business and consumer.",quarter,Brian Moynihan,CEO,21,Q and A,Q1_2024,2024-04-16
"People paying taxes out on the wealthier side and receiving benefits on the tax refund side. So as we stabilize in that, we expect it to grow.",quarter,Brian Moynihan,CEO,21,Q and A,Q1_2024,2024-04-16
"We don't expect a massive change in how the deposits are structured from a -- what's in money markets, what's in savings, what's in checking, what's in that. It's really slowed down and been relatively stable. So things bump around, but it's all very good value, even the highest-paid balances in the wealth management business are good value for the company.",quarter,Brian Moynihan,CEO,21,Q and A,Q1_2024,2024-04-16
"But if you look at what really drives the value to the $950-odd billion in checking balances, you can see on Page 7 the core checking balances, that's what drives it.",quarter,Brian Moynihan,CEO,21,Q and A,Q1_2024,2024-04-16
"Yes. You're still feeling, Brian, like the bulk of people that have kind of moved on rate-seeking behavior likely have done so.",quarter,John McDonald,Analyst,22,Q and A,Q1_2024,2024-04-16
"Yes. If you look on the consumer business and you think about tracking those deposits accounts from pre-pandemic to now, which is one thing we talked about for different purposes. But if you look at where all the deposit balances, if people with lower average balances are still multiples of where they were pre-pandemic, people with higher balances are actually lower because, obviously, they were sitting on cash when the pandemic and accumulate more cash. And when rates came up, they moved it.",quarter,Brian Moynihan,CEO,22,Q and A,Q1_2024,2024-04-16
