text,fiscal_period_ref,speaker,role,page,section,reporting_period,date_of_call
"Bank of America (BAC) Q1 2024 Earnings Call 
Transcript",quarter,Other,Other,1,Introduction,Q1_2024,2024-04-16
"BAC earnings call for the period ending March 31, 2024.",quarter,Other,Other,1,Introduction,Q1_2024,2024-04-16
"Good day, everyone, and welcome to the Bank of America earnings announcement. [Operator instructions] Please note, this call may be recorded. [Operator instructions] It is my pleasure to turn the conference over to Lee McEntire of Bank of America.",quarter,Operator,Host,1,Introduction,Q1_2024,2024-04-16
"Good morning. Thank you, Leo. Welcome, and thank you for joining the call to review our first-quarter results. Our earnings release documents are available on the Investor Relations section of the bankofamerica.com website, and that includes the earnings presentation that we will be referring to during the call.",quarter,Lee McEntire,Other,1,Introduction,Q1_2024,2024-04-16
"I trust that everyone's had a chance to review the documents. I'm going to first turn the call over to our CEO, Brian Moynihan, for some opening comments before Alastair Borthwick, our CFO, discusses the details of the quarter.",quarter,Lee McEntire,Other,1,Introduction,Q1_2024,2024-04-16
"Before they begin, let me just remind you, we may make forward-looking statements and refer to non-GAAP financial measures during the call.",quarter,Lee McEntire,Other,1,Disclaimer,Q1_2024,2024-04-16
Forward-looking statements are based on management's current expectations and assumptions that are subject to risks and uncertainties.,quarter,Lee McEntire,Other,2,Disclaimer,Q1_2024,2024-04-16
"Factors that may cause our actual results to materially differ from expectations are detailed in our earnings materials, our SEC filings that are available on our website. Information about non-GAAP financial measures, including the reconciliations to U.S. GAAP, can also be found in our earnings materials that are available on the website. So with that, I'll turn the call over to you, Brian.",quarter,Lee McEntire,Other,2,Disclaimer,Q1_2024,2024-04-16
Thanks.,quarter,Lee McEntire,Other,2,Disclaimer,Q1_2024,2024-04-16
"Thank you, Lee, and good morning to all of you, and thank you for joining us. I am starting on Slide 2 of the earnings presentation. We once again delivered a strong set of results in Quarter 1. We reported net income of $6.7 billion after tax and EPS of $0.76.",quarter,Brian Moynihan,CEO,2,Prepared remarks,Q1_2024,2024-04-16
"This included the additional expense accrual for the industry's special assessment by the FDIC to recover losses from the failures of Silicon Valley Bank and Signature Bank. This lowered our Quarter 1 EPS by $0.07. Excluding net expense, net income was $7.2 billion and EPS was $0.83 per share in Quarter 1. Alastair is going to walk you through the details of the quarter momentarily.",quarter,Brian Moynihan,CEO,2,Prepared remarks,Q1_2024,2024-04-16
"But first, let me give you a few thoughts on our performance. We delivered good improvement in our fee-based business, driven both by continued organic growth and good market conditions. Investment banking saw a nice rebound this quarter. We delivered nearly $1.6 billion in investment banking fees and grew 35% from the first-quarter 2023.",quarter,Brian Moynihan,CEO,2,Prepared remarks,Q1_2024,2024-04-16
"Matthew Koder and the team have done a great job delivering market share growth. In addition, our results reflect the benefits of investments beta, our middle-market investment banking teams and dual-coverage teams.",quarter,Brian Moynihan,CEO,2,Prepared remarks,Q1_2024,2024-04-16
Matthew has utilized his benefit and power wisely to grow our middle-market team from 15 bankers in 2018 across a dozen cities to more than 200 bankers in twice as many cities today. Both groups work with our commercial bankers and wealth management advisors in those cities to deliver for our clients.,quarter,Brian Moynihan,CEO,3,Prepared remarks,Q1_2024,2024-04-16
Investment in brokerage services revenue across Merrill and the Private Bank grew 11% year over year in Quarter 1 to nearly $3.6 billion. Continued investments in our advisor training programs and digital delivery for our clients as well as positive market helped us deliver strong revenue. Asset under management flows were $25 billion in the quarter.,quarter,Brian Moynihan,CEO,3,Prepared remarks,Q1_2024,2024-04-16
"Sales and trading, excluding DVA, delivered its eighth consecutive quarter of year over year revenue improvement.",quarter,Brian Moynihan,CEO,3,Prepared remarks,Q1_2024,2024-04-16
"At $5.2 billion, this is the highest first-quarter result in over a decade. We have allocated more balance sheet invested in talent to build on our strengths for the last five years in this business. Those investments, plus the intensity of the teams under Jimmy DeMare's leadership has resulted in good momentum and market share improvement.",quarter,Brian Moynihan,CEO,3,Prepared remarks,Q1_2024,2024-04-16
"From a balance sheet perspective, we entered the quarter expecting modest loss in loan growth and a decline in deposits, those were our expectations.",quarter,Brian Moynihan,CEO,3,Prepared remarks,Q1_2024,2024-04-16
"What we actually delivered was growth in any deposits of more than $20 billion. Ending loans were down modestly due to the expected credit card seasonality. Otherwise, loans are pretty stable. This balance sheet performance, along with our continued pricing discipline, allowed us to deliver better-than-expected NII performance.",quarter,Brian Moynihan,CEO,3,Prepared remarks,Q1_2024,2024-04-16
"We told you last quarter that we expected NII to decline from the fourth quarter of 2023 to the first quarter of 2024, a decline about $100 million to $200 million. We actually reported today NII of $14.2 billion. That was $100 million higher than Quarter 4, exceeding our guidance.",quarter,Brian Moynihan,CEO,3,Prepared remarks,Q1_2024,2024-04-16
We continue to deliver strong expense management.,quarter,Brian Moynihan,CEO,3,Prepared remarks,Q1_2024,2024-04-16
"Year-over-year expenses, adjusted for the FDIC assessment, was up a little less than 2%. That compares to a 4%-plus inflation rate. We also continue to invest in our company while managing those expenses. We had several categories of stronger fee-based revenue in the first quarter this year.",quarter,Brian Moynihan,CEO,4,Prepared remarks,Q1_2024,2024-04-16
This drove higher formulaic compensation and processing costs of the increased activity. Fees and commissions were up 10% year over year. We are happy to pay for that revenue and deliver warnings to the bottom line because of it. So how did we do all that and hold expenses under the inflation rate?,quarter,Brian Moynihan,CEO,4,Prepared remarks,Q1_2024,2024-04-16
"Well, we remain focused on three primary drivers of Bank of America.",quarter,Brian Moynihan,CEO,4,Prepared remarks,Q1_2024,2024-04-16
"First, our operational excellence platform continues to deliver and improve processes. These savings from that growth helped fund the future growth in the company and lower the risk. Second, we managed head count as we eliminated work. Recall, we noted the expectation in January of last year that our head count will be down throughout the year.",quarter,Brian Moynihan,CEO,4,Prepared remarks,Q1_2024,2024-04-16
"Our head count at the end of first-quarter 2024 is down by more than 4,700 people from the first-quarter 2023. It declined 650 people just for the end of 2023. The digitization activity is also driving ongoing expense cost savings, customer retention, and market share improvement, driving across all three factors. It also then supports the ever-increasing volumes of client activity with little increased cost.",quarter,Brian Moynihan,CEO,4,Prepared remarks,Q1_2024,2024-04-16
I would highlight our continued capital strength with common equity Tier 1 capital of $197 billion. That amount of capital is $31 billion over the current regulatory minimums for our company. That capital has allowed us to both support our clients and returned $4.4 billion to shareholders this quarter and share repurchases and dividends. Let me highlight a few points on organic growth before I pass over to Alastair.,quarter,Brian Moynihan,CEO,4,Prepared remarks,Q1_2024,2024-04-16
"Now I'm turning to Slide 3. You can see Slide 3, the highlights of the Quarter 1 success for organic activity across the businesses. We continue to invest and enhance our digital platforms. We provide our customers with convenient and secure banking experiences.",quarter,Brian Moynihan,CEO,4,Prepared remarks,Q1_2024,2024-04-16
"By leveraging our technology and continuous investment in that technology and putting customers at the center of everything we do, we have successfully deepened our relationships and expanded our customer base across all our businesses. In consumer, we added 245,000 net new checking accounts this quarter. This completes 21 straight quarters of net additions. Dean Athanasia, Aron Levine, and Holly O'Neill helped drive that business for us and continue to perform well, driving strong performance across our consumer franchise.",quarter,Brian Moynihan,CEO,5,Prepared remarks,Q1_2024,2024-04-16
"These checking balances continue to drive the performance of our consumer deposits. These checking additions are important for many other reasons. On average, 68% of our deposit balances have been with us for more than 10 years.",quarter,Brian Moynihan,CEO,5,Prepared remarks,Q1_2024,2024-04-16
"92% of the customer checking accounts are primary checking accounts in the household, meaning that they're the core operating account for the household for their financial lives.",quarter,Brian Moynihan,CEO,5,Prepared remarks,Q1_2024,2024-04-16
"So when we onboard a client, we start a long-term valuable relationship. About 60% of our checking accounts customers use a debit card, and in average they do about 400 transactions per year on that card.",quarter,Brian Moynihan,CEO,5,Prepared remarks,Q1_2024,2024-04-16
"The new checking accounts have traditionally opened savings accounts, about 25% of the time within a few months of opening that checking account. And opening a new checking account on average brings about $4,000 in balances below our averages.",quarter,Brian Moynihan,CEO,5,Prepared remarks,Q1_2024,2024-04-16
"But that continues to grow, and within a year, it's two times that amount. Likewise, when we open a new savings account, it on average brings about $7,000 in balances. This also deepened it by about two times during the year. Investment relationships and credit card account openings continue to be strong in the first quarter as well.",quarter,Brian Moynihan,CEO,5,Prepared remarks,Q1_2024,2024-04-16
"And while we believe some of these statistics are best-in-class, rest assured, there are plenty of opportunities for further growth in our franchise and our company. As we think about our Global Wealth team led by Eric Schimpf, Lindsay Hans, and Katy Knox, that team added 7,300 net new wealth relationships at the Merrill and the Private Bank. Our advisors opened 29,000 new bank accounts in the quarter with our customers deepening the relationships.",quarter,Brian Moynihan,CEO,5,Prepared remarks,Q1_2024,2024-04-16
"More than 60% are investing clients in Merrill, and 90% of our private banking clients now have a core banking relationship with us.",quarter,Brian Moynihan,CEO,6,Prepared remarks,Q1_2024,2024-04-16
"In addition, across our wealth spectrum, we saw $60 billion in total flows over the last year. As you can see on the slide, we now manage more than $5.6 trillion in total client balances across loans, deposits, and investments in consumer and wealth management.",quarter,Brian Moynihan,CEO,6,Prepared remarks,Q1_2024,2024-04-16
"When we move to Global Banking, we added more new relationships in this quarter than we did in last year's first quarter. We also increased the number of solutions per relationship with preexisting clients.",quarter,Brian Moynihan,CEO,6,Prepared remarks,Q1_2024,2024-04-16
"Just like in our consumer business, we have seen good growth in customers seeking the benefits of both our physical and our online capabilities and our talent, and also the care of our talented relationship managers who provide financing solutions and advice for our clients with global needs.",quarter,Brian Moynihan,CEO,6,Prepared remarks,Q1_2024,2024-04-16
"A couple of other points I'd make on our digital success. Erica, our virtual banking assistant, reached a key milestone of more than 2 billion interactions since its introduction about 6 years ago. It took four years to reach 1 billion interactions.",quarter,Brian Moynihan,CEO,6,Prepared remarks,Q1_2024,2024-04-16
"It took just 18 months to reach the second billion. In August, we extended Erica's reach and launched Erica in our Global Treasury Services business and CashPro. Erica, as a result, 43% of the CashPro chat inquiries automatedly, demonstrating more and more clients are able to self-solve. This is a great example of best practices being shared across the scale of our company.",quarter,Brian Moynihan,CEO,6,Prepared remarks,Q1_2024,2024-04-16
"Second, as an example of our digital success, Zelle continues to grow. It wasn't long ago that we noted that the number of Zelle transactions in a quarter had surpassed the numbers of checks written. Shortly after that, Zelle transactions reached two times the number of checks written.",quarter,Brian Moynihan,CEO,6,Prepared remarks,Q1_2024,2024-04-16
"This quarter, Zelle transactions has now passed the combined number of checks written, plus the amount of cash withdrawals from tellers and from ATMs.",quarter,Brian Moynihan,CEO,6,Prepared remarks,Q1_2024,2024-04-16
"That is a rapid adoption and represents continued cost savings and convenience and security for the customers. These stats and others are included in our quarterly [Inaudible] for our digital banking progress. That's included in Slides 20, 22, and 24. I encourage you to read them.",quarter,Brian Moynihan,CEO,7,Prepared remarks,Q1_2024,2024-04-16
"They show our market-leading efforts, representing billions of dollars of our investment over the years, and we are continuing to drive growth with expense growth under control. This solid earnings results achieved this quarter are testament to the dedication and talent of our 212,000 people who work here and deliver for our customers every day. I thank them for another great quarter. And with that, I'll turn it over to Alastair.",quarter,Brian Moynihan,CEO,7,Prepared remarks,Q1_2024,2024-04-16
"Thank you, Brian. And I'm going to start on Slide 4 of the earnings presentation. So Brian covered much of the income statement highlights, and he noted the difference in our reported results and the results adjusted for the FDIC assessment. So I'm not going to repeat that.",quarter,Alastair Borthwick,CFO,7,Prepared remarks,Q1_2024,2024-04-16
"I'd just add that we delivered strong returns. On a reported basis, our return on average assets was 83 basis points, and return on tangible common equity was 12.7%. And when adjusted for the FDIC assessment, our efficiency ratio was 64%, ROA at 89 basis points, and ROTCE at 14%.",quarter,Alastair Borthwick,CFO,7,Prepared remarks,Q1_2024,2024-04-16
"So let's move to the balance sheet on Slide 5, where we ended the quarter at $3.27 trillion of total assets, up $94 billion from the fourth quarter.",quarter,Alastair Borthwick,CFO,7,Prepared remarks,Q1_2024,2024-04-16
"And the bulk of that increase was in Global Markets to support seasonally elevated levels of client activity. Outside of the Global Markets activity, we'd highlight both the $23 billion growth in deposits and the $20 billion decline in cash levels.",quarter,Alastair Borthwick,CFO,7,Prepared remarks,Q1_2024,2024-04-16
"So with that increase in liquidity, you'll also note that debt securities increased $39 billion, which included an $8 billion decline in hold-to-maturity securities and a $47 billion increase in AFS securities. And those are mostly hedged U.S. treasuries added with yields effectively at cash rates.",quarter,Alastair Borthwick,CFO,7,Prepared remarks,Q1_2024,2024-04-16
"At $313 billion, our absolute cash levels remain higher than required. Liquidity remained strong with $909 billion of global liquidity sources, and that's up $12 billion from the fourth quarter and remains $333 billion above our pre-pandemic fourth quarter '19 level.",quarter,Alastair Borthwick,CFO,7,Prepared remarks,Q1_2024,2024-04-16
"Shareholders' equity increased $1.9 billion from the fourth quarter earnings, as they were only partially offset by capital distributed to shareholders.",quarter,Alastair Borthwick,CFO,8,Prepared remarks,Q1_2024,2024-04-16
"And AOCI was little changed in the quarter. During the quarter, we paid out $1.9 billion in common dividends and we bought back $2.5 billion in shares, which more than offset our employee awards.",quarter,Alastair Borthwick,CFO,8,Prepared remarks,Q1_2024,2024-04-16
"As part of those share awards in the first quarter, we announced our seventh consecutive year of sharing success compensation awards, covering more than 95% of our associates and further aligning their interest with shareholders. Tangible book value per share of $24.79 is up 9% year over year.",quarter,Alastair Borthwick,CFO,8,Prepared remarks,Q1_2024,2024-04-16
"Looking at regulatory capital, our CET1 level improved to $197 billion from December 31st, and the CET1 ratio was stable at 11.8% and remained well above our current 10% requirement.",quarter,Alastair Borthwick,CFO,8,Prepared remarks,Q1_2024,2024-04-16
"We also remain quite well-positioned against the current proposed capital rules, as our CET1 level is also above the 10% requirement even when we include estimated RWA inflation from those new proposed rules.",quarter,Alastair Borthwick,CFO,8,Prepared remarks,Q1_2024,2024-04-16
"Risk-weighted assets increased modestly, driven by client activity in Global Markets. And our supplemental leverage ratio was 6%, compared to a minimum requirement of 5%, which leaves capacity for balance sheet growth.",quarter,Alastair Borthwick,CFO,8,Prepared remarks,Q1_2024,2024-04-16
"And at $475 billion of total loss-absorbing capital, our TLAC ratio remains comfortably above our requirements. Let's turn our balance sheet focus to loans by looking at the average balances on Slide 6.",quarter,Alastair Borthwick,CFO,8,Prepared remarks,Q1_2024,2024-04-16
"Average loans in the first quarter of $1.048 trillion were flat compared to the fourth quarter, and they improved 1% year over year as solid credit card growth was partially offset by declines in securities-based lending. Commercial loans grew modestly year over year.",quarter,Alastair Borthwick,CFO,8,Prepared remarks,Q1_2024,2024-04-16
"We experienced modest improvement in revolver utilization and commercial lending in the first quarter, and that's being offset for the most part by paydowns as larger client financing solutions are being met through capital markets access.",quarter,Alastair Borthwick,CFO,8,Prepared remarks,Q1_2024,2024-04-16
"And lastly on a positive note, loan spreads continued to widen. Moving to deposits. We'll stay focused on averages on Slide 7.",quarter,Alastair Borthwick,CFO,9,Prepared remarks,Q1_2024,2024-04-16
"And relative to pre-pandemic Q4 2019, average deposits are still up 35%. Every line of business remains well above their pre-pandemic levels, and consumer is up 32% with checking up 38%, driven by net new checking accounts added, as Brian noted earlier.",quarter,Alastair Borthwick,CFO,9,Prepared remarks,Q1_2024,2024-04-16
Linked-quarter total average deposits remained steady at more than $1.9 trillion. The total rate paid on consumer deposits in the quarter was 55 basis points.,quarter,Alastair Borthwick,CFO,9,Prepared remarks,Q1_2024,2024-04-16
"And while the rate increased 9 basis points from the fourth quarter, the pace of increases continues to slow. The mix of low-rate and high-quality transactional accounts keeps the rate paid low.",quarter,Alastair Borthwick,CFO,9,Prepared remarks,Q1_2024,2024-04-16
Wealth Management and Global Banking also saw a slowdown in the increases in their rate paid and slowdown in the rotation out of noninterest-bearing accounts in the first quarter. Focusing for a moment on ending deposits and movement from the fourth quarter.,quarter,Alastair Borthwick,CFO,9,Prepared remarks,Q1_2024,2024-04-16
"This quarter, we delivered good deposit growth. Total deposits grew $23 billion, and they're now $100 billion above their trough in mid-May of 2023.",quarter,Alastair Borthwick,CFO,9,Prepared remarks,Q1_2024,2024-04-16
Consumer Banking deposits saw growth in both consumer interest-bearing and noninterest-bearing. Global Banking continued their more normal pattern of deposits seen for the past five quarters and up more than $30 billion over the last year.,quarter,Alastair Borthwick,CFO,9,Prepared remarks,Q1_2024,2024-04-16
"Deposit growth exceeded loan growth for the third straight quarter and our excess of deposits over loans expanded to $897 billion, and that's nearly two times the $450 billion we had pre-pandemic. You can see that on the upper left-hand side of Slide 8.",quarter,Alastair Borthwick,CFO,9,Prepared remarks,Q1_2024,2024-04-16
"We continue to have a mix of cash available-for-sale securities and held-to-maturity securities. And this quarter, our combination of cash and AFS is now 52% of the total $1.2 trillion noted on this page.",quarter,Alastair Borthwick,CFO,9,Prepared remarks,Q1_2024,2024-04-16
"You'll also notice the continued change in mix of the shorter-term portfolio, as we again lowered cash and increased AFS securities that are mostly hedged and have similar yields to the cash. Note also the hold-to-maturity book continues to decline from paydowns.",quarter,Alastair Borthwick,CFO,9,Prepared remarks,Q1_2024,2024-04-16
"In total, the hold-to-maturity book is now down $96 billion from its peak, and it consists of about $122 billion in treasuries and about $458 billion in mortgage-backed securities, along with $7 billion of other securities.",quarter,Alastair Borthwick,CFO,10,Prepared remarks,Q1_2024,2024-04-16
"Lastly, the blended cash and securities yield of 360 basis points continued to rise and remained about 168 basis points above the rate we pay for deposits.",quarter,Alastair Borthwick,CFO,10,Prepared remarks,Q1_2024,2024-04-16
"The replacement of lower-earning assets into higher-yielding assets continues to provide an ongoing benefit to NII. Let's turn our focus to NII performance using Slide 9, where you can see on a fully tax equivalent basis, NII was $14.2 billion.",quarter,Alastair Borthwick,CFO,10,Prepared remarks,Q1_2024,2024-04-16
"Good deposit growth provided a strong start to the year for NII. And as Brian noted, NII of $14.2 billion increased by $100 million from the fourth quarter.",quarter,Alastair Borthwick,CFO,10,Prepared remarks,Q1_2024,2024-04-16
"Now that compares to our expectation and guidance of a decline of $100 million to $200 million, and that would have resulted in NII this quarter of $13.9 billion or $14 billion. So we did quite a bit better than we had originally expected.",quarter,Alastair Borthwick,CFO,10,Prepared remarks,Q1_2024,2024-04-16
"The improvement in quarterly NII in Q1 compared to Q4 included the benefits of higher-yielding assets and improvement in Global Markets NII, partially offset by higher deposit costs and one less day in Q1 than Q4 '23. Deposit balance activity more generally also aided in the beat versus our expectations.",quarter,Alastair Borthwick,CFO,10,Prepared remarks,Q1_2024,2024-04-16
"As we look forward for Q2, we expect some modest impact of lower deposits in wealth management as clients make their seasonal income tax payments. And we expect Global Markets NII to decline mostly seasonally a little bit as well.",quarter,Alastair Borthwick,CFO,10,Prepared remarks,Q1_2024,2024-04-16
"So we expect second-quarter NII could approach $14 billion on an FTE basis. And further, we continue to expect that Q2 will be the low point for NII, and we expect the back half of 2024 to grow.",quarter,Alastair Borthwick,CFO,10,Prepared remarks,Q1_2024,2024-04-16
"And compared to our guidance last quarter, we're obviously growing off a larger base of NII after having outperformed in the first quarter. With regard to that forward view, let me just note a few other caveats.",quarter,Alastair Borthwick,CFO,10,Prepared remarks,Q1_2024,2024-04-16
"It includes our assumption that interest rates in the forward curve at the end of the quarter materialize. And at the end of the first quarter, there were still three cuts expected this year starting in June.",quarter,Alastair Borthwick,CFO,11,Prepared remarks,Q1_2024,2024-04-16
"Our forward view also includes an expectation of low single-digit loan growth and some moderate growth in deposits as we move into the back half of 2024. And given our recent deposit and loan performance, we continue to feel good about these assumptions.",quarter,Alastair Borthwick,CFO,11,Prepared remarks,Q1_2024,2024-04-16
"Turning to asset sensitivity and focused on a forward yield curve basis, our sensitivity to the plus and minus 100 basis point parallel shift in the forward curve at March 31st remains well balanced. OK. Let's turn to expense.",quarter,Alastair Borthwick,CFO,11,Prepared remarks,Q1_2024,2024-04-16
